{
  "id": "gamma_cementite",
  "name_ru": "Аустенит + цементит (высокотемпературный)",
  "name_en": "Austenite + cementite",
  "reference_section": "§1.2 / §1.4",
  "reference_sources": [
    "Гуляев А.П. Металловедение. 1986"
  ],
  "phase_composition": { "AUSTENITE": 0.72, "CEMENTITE": 0.28 },
  "rgb_tones": {
    "nital": {
      "austenite": [230, 228, 222],
      "cementite_globules": [45, 35, 25],
      "boundaries": [90, 85, 80]
    }
  },
  "morphology": {
    "grain_size_um": { "mean": 40, "min": 20, "max": 80 },
    "cementite_globule_size_um": { "min": 0.3, "max": 3.0 },
    "cementite_density_per_um2": 0.02,
    "boundary_bias": 0.75,
    "notes": "Аустенитная матрица + округлые цементитные частицы, преимущественно по границам γ-зёрен (≥70% на границах). Характерно для гипереутектоидов выше A1."
  },
  "composition_triggers": {
    "c_wt_range": [0.77, 2.14],
    "temperature_c_range": [727, 1147]
  },
  "generation_hints": {
    "voronoi_relax_iter": 3,
    "carbide_poisson_density_per_um2": 0.02,
    "carbide_size_lognormal_mu": 1.0,
    "carbide_size_lognormal_sigma": 0.3
  }
}
