{
  "id": "liquid_gamma",
  "name_ru": "Жидкость + аустенит (дендриты)",
  "name_en": "Liquid + austenite dendrites",
  "reference_section": "§3.1",
  "reference_sources": [
    "Гуляев А.П. Металловедение. 1986",
    "Kurz W., Fisher D.J. Fundamentals of Solidification. 1984"
  ],
  "phase_composition": { "LIQUID": 0.62, "AUSTENITE": 0.38 },
  "rgb_tones": {
    "nital": {
      "dendrite_axes": [220, 215, 205],
      "interdendritic": [90, 80, 70],
      "liquid_matrix": [230, 228, 222]
    },
    "klemm_1": {
      "dendrite_axes": [210, 180, 120],
      "interdendritic": [80, 100, 160]
    }
  },
  "morphology": {
    "pdas_primary_dendrite_arm_spacing_um": { "min": 100, "max": 1000 },
    "sdas_secondary_dendrite_arm_spacing_um": {
      "formula": "40.7 * cooling_rate_c_per_s ** (-1/3)",
      "typical_range_um": [5, 90]
    },
    "branch_angle_deg": 90,
    "anisotropy_ratio": 4.0,
    "notes": "Первичные/вторичные/третичные оси дендритов под 90° (BCC/FCC симметрия). Оси бедны C (k<1), межосные обогащены. Blur σ=2-5 μm."
  },
  "composition_triggers": {
    "temperature_c_range": [1400, 1493],
    "cooling_rate_c_per_s_range": [0.1, 1000]
  },
  "generation_hints": {
    "texture_method": "l_system_dendrites_over_liquid",
    "trunk_count_min": 3,
    "trunk_count_max": 8,
    "blur_sigma_um": 3.0
  }
}
