{
  "id": "tempered_high",
  "name_ru": "Сорбит отпуска (500-650°C, Q+T «улучшение»)",
  "name_en": "Tempered sorbite (high temper, Q+T)",
  "reference_section": "§2.13",
  "reference_sources": [
    "Krauss G. Steels: Processing, Structure, and Performance. ASM Int., 2015",
    "Гуляев А.П. Металловедение. 1986"
  ],
  "phase_composition": { "SORBITE": 0.42, "FERRITE": 0.40, "CEMENTITE": 0.18 },
  "rgb_tones": {
    "nital": {
      "matrix": [165, 150, 135],
      "boundaries": [80, 68, 58],
      "carbides": [35, 28, 22],
      "carbide_halo": [180, 170, 155]
    }
  },
  "morphology": {
    "polygonal_ferrite_grain_size_um": { "min": 2, "max": 10, "mean": 4 },
    "dislocation_density_per_m2": { "min": 1e12, "max": 1e13 },
    "carbide_size_um": { "min": 0.2, "max": 1.0, "mean": 0.4 },
    "carbide_density_per_um3": { "min": 0.15, "max": 0.3 },
    "boundary_bias": 0.7,
    "no_lath_geometry": true,
    "no_retained_austenite": true,
    "notes": "Полигональный феррит + сферические карбиды Fe₃C. Лучший комплекс прочность/вязкость — классический улучшенный материал. HRC 20-35. Для Mo/V/Cr — секундарное твердение."
  },
  "composition_triggers": {
    "c_wt_range": [0.3, 0.6],
    "temper_temperature_c_range": [500, 650]
  },
  "generation_hints": {
    "voronoi_grain_size_px": 4.5,
    "carbide_count_per_area_coefficient": 0.15,
    "carbide_lognormal_mu": 0.35,
    "carbide_lognormal_sigma": 0.15,
    "carbide_boundary_bias": 0.7,
    "carbide_halo_px": 0.05
  }
}
